group,set,condition,context-type,context,sentence,question,FALSE,CORRECT,FIRST,SECOND
D,32,c,נפרד,הספרניות ארגנו ביחד את התיקיות בקטלוג והרכזת הכינה מצגת מסכמת,תוך כדי העבודה הרכזת זירזה את הספרנית שהפועלים האיטיים והיסודיים עזרו לה בהכנות,?למי הפועלים עזרו,הרכזת,הספרנית,הרכזת,הספרנית
D,1,filler,filler,הטייסת והדיילות תפעלו את המערכת,לפני תחילת הנסיעה הדיילת שהנוסעים ריגשו הביטה בטייסת בעלת התסרוקת המוזרה,?את מי הנוסעים ריגשו,הטייסת,הדיילת,הדיילת,הטייסת
D,2,filler,filler,חנות השירות העצמי נפתחה לפני שבוע,בגלל חוסר אחריות המכונה שנשברה על-ידי הצרכנים המגושמים חשפה את קופסת הכסף שבתוכה,?מה הצרכנים שברו,קופסת הכסף,המכונה,המכונה,קופסת הכסף
D,3,filler,filler,הבנאים מרעישים הרבה בלילה,בנוסף לרעש המרפאה שנבנית על-ידי הבנאים החרוצים מסתירה את הדירה שבקצה השכונה,?מה הבנאים בונים,הדירה,המרפאה,המרפאה,הדירה
D,4,filler,filler,האומנת כיבסה את הבגדים והאמא בישלה ארוחת ערב,אחרי חיפוש ארוך באינטרנט האמא שתמיד התלהבה ממותגים יקרים שכרה את האומנת היצירתית,?את מי המותגים מלהיבים,האומנת,האמא,האמא,האומנת
D,5,filler,filler,האצניות צפו במירוץ ביחד,בדרך הביתה אחרי המירוץ האצנית שהתאכזבה מהעמיתים שלה הביטה בבחורה הבוכה לבד בצד הדרך,?את מי הקרובים אכזבו,הבחורה,האצנית,האצנית,הבחורה
D,6,filler,filler,הכבשים נלקחו לבדיקה כללית והתרנגולת הסתובבה לידן,אחרי הבדיקה הכבשה שטופלה על-ידי החקלאי בעטה בתרנגולת שהיתה לידה,?במי החקלאי טיפל,התרנגולת,הכבשה,הכבשה,התרנגולת
D,7,filler,filler,אתמול התקיימה פגישה על הצוואה,הבוקר האלמנה שהחשבונאים הקפדנים העריכו החליטה לתרום לחברה במקום להחליט על יורשת,?את מי החשבונאים העריכו,לחברה,האלמנה,האלמנה,לחברה
D,8,filler,filler,הכדורגלניות צפו בתחרות ביחד בערב,במהלך המשחק המתמודדים העליבו את הכדורגלנית החלשה שניצלה את העמיתה שלה מהקבוצה הגדולה,?את מי המתמודדים העליבו,העמיתה,הכדורגלניות,הכדורגלניות,העמיתה
D,9,filler,filler,הכדורסלניות והמאמנת הסתודדו,בגמר הגדול הכדורסלנית שהקהל כיבד כי היא מקשיבה למאמנת המנוסה שיחקה מצוין,?את מי הקהל מכבד,המאמנת,הכדורסלניות,הכדורסלניות,המאמנת
D,10,filler,filler,המנקות יצאו לטייל בפארק ביחד,המנקה שכעסה על המעסיקים ביקשה מהשכירה היומית שתעשה את העבודה שלה במקומה,?את מי המעסיקים הכעיסו,השכירה,המנקה,המנקה,השכירה
D,11,filler,filler,הגבירה שתתה תה והחייטת מדדה את הבד,באותו יום הגבירה שהיתה מתוסכלת מהעיצוב הפשוט של השמלה הרחיקה את החייטת הענייה מהמפעל,?את מי העיצוב תסכל,החייטת,הגבירה,הגבירה,החייטת
D,12,filler,filler,השחקניות השתתפו ביחד במשחק הראשון של הטורניר,אחרי הענקת המדליות השוערת שניצחה במשחק האלים של שכבת הנוער נעלבה מהשופט ובעטה בשחקנית שעמדה בצד,?את מי השופט העליב,השחקנית,השוערת,השוערת,השחקנית
D,13,filler,filler,המארגנת מילאה את הכוס שלה בזמן שהתקליטנית בחרה שיר,לפני ההופעה הגברים הציקו לתקליטנית שהיתה עסוקה בשיחה עם המארגנת,?למי הגברים הציקו,המארגנת,התקליטנית,התקליטנית,המארגנת
D,14,filler,filler,החזירות התגלגלו באדמה בעוד החתולה שיחקה בצמחים,באותו יום היו שם בחורים אכזריים שהרביצו לחתולה ששיחקה הכי קרוב לחזירות,?למי הבחורים הרביצו,החזירות,החתולה,החתולה,החזירות
D,15,filler,filler,הפרה ישנה בשמש והסוסות שיחקו ליד הבריכה,קצת אחרי הסוסה האצילה שהילדים רכבו עליה פגעה בפרה הלבנה שהיתה ליד הבריכה,?על מי הילדים רכבו,הפרה,הסוסה,הסוסה,הפרה
D,16,filler,filler,הכרטיסנית והבת שלה עלו ביחד לרכבת,לפני הנסיעה הכרטיסנית שכעסה בגלל הנוסעים שוחחה עם הבת שלה שדפדפה באינסטגרם,?את מי הנוסעים הכעיסו,הבת,הכרטיסנית,הכרטיסנית,הבת
D,17,filler,filler,הילדה דיברה עם האמהות בגן,לפני זה הילדה שהתעצבנה מהילד המפונק של השכנים דיברה עם אמה שהיתה עסוקה ולא התייחסה אליה,?את מי הילד עיצבן,האם,הילדה,הילדה,האם
D,18,filler,filler,בדיקות הראייה הפכו מאד יקרות,אחרי הביקור הרפואי החולָה קיבלה החזר כספי מקופת החולים כי היא התאכזבה מהאופטיקאית הצעירה,?למי קופת החולים נתנה החזר כספי,האופטיקאית,החולָה,החולָה,האופטיקאית
D,19,filler,filler,הסטנדאפיסטיות החליטו להמשיך לחגוג והזוכה התכוננה לחזור הביתה,בעקבות האירוע הזוכה כעסה על הקהל כי הוא לא השתתף בהופעה של הסטנדאפיסטית הקרובה אליה,?את מי הקהל הכעיס,הסטנדאפיסטית,הזוכה,הזוכה,הסטנדאפיסטית
D,20,filler,filler,הדודות בישלו ארוחת ערב כשהפושעת הסתובבה בשכונה,בסיום הארוחה הדודה הפחדנית שהתושבים הזהירו מכניסת הפושעת המסוכנת לבניין שלה נעלה את הדלת,?את מי התושבים הזהירו,הפושעת,הדודה,הדודה,הפושעת
D,21,filler,filler,הנשים והליצניות התכוננו ביחד למסיבה,בתחילת המסיבה האישה שהחוגגים התשושים הפחידו צעקה והלחיצה את הליצנית הידידותית,?את מי החוגגים הפחידו,הליצנית,האישה,האישה,הליצנית
D,22,filler,filler,הכלבה והגורות שחו באגם ביחד,באותו יום הגורה שהוטרינר הרים נשכה את הכלבה המסכנה כי היא פחדה,?את מי הוטרינר הרים,הכלבה,הגורה,הגורה,הכלבה
D,23,filler,filler,הילדות רצו בחצר ביחד,באותו זמן הכלבה שנבהלה מהחתולים האגרסיביים של הסבתא רדפה אחרי הילדה הקטנה ביותר בחבורה,?את מי החתולים הבהילו,הילדה,הכלבה,הכלבה,הילדה
D,24,filler,filler,המנקות והמשרתות רוקנו את המקרר,אחרי הזזת המקרר העדים הפלילו את המשרתת החדשה שעמדה צמוד למנקה הנמוכה ודיברה איתה,?את מי העדים הפלילו,המנקה,המשרתת,המשרתת,המנקה
D,25,filler,filler,הנשים והמומחיות השתתפו ביחד בתכנית מיוחדת,בתקופה זו המומחית שהאסיסטנטים אירחו טיפלה באישה האמיצה שנלחמה במחלה,?את מי האסיסטנטים אירחו,האישה,המומחית,המומחית,האישה
D,26,filler,filler,ההפגנה התחילה בכיכר הקרובה,אחרי ההפגנה המפגינים איימו על הנערה הרגועה שהצביעה על המתפללת מהכפר הקטן,?על מי המפגינים איימו,המתפללת,הנערה,הנערה,המתפללת
D,27,filler,filler,השקת הספר היתה מרגשת,במהלך האירוע המשוררת שהקהל הקשוח אהב תמכה בנכדה המוכשרת שלה כדי שתגשים את חלומה,?את מי הקהל אהב,הנכדה,המשוררת,המשוררת,הנכדה
D,28,filler,filler,הפעילות נפגשו אתמול בבוקר,באותו בוקר השרה הוותיקה שהאנליסטים ליוו במהלך ניסוח החוק ביקשה מהפעילה לעזור בקידומו,?את מי האנליסטים ליוו,הפעילה,השרה,השרה,הפעילה
D,29,filler,filler,הכבאיות הוזעקו לאזור השריפה,אחרי השריפה השומרת שמנעה את הכבאית מלהיכנס לאזור המסוכן הוענשה על-ידי התושבים של הכפר,?את מי התושבים הענישו,הכבאית,השומרת,השומרת,הכבאית
D,30,filler,filler,המשרדים הסמוכים חוברו למשרד אחד,בגלל השינוי המוקדנית שהתבלבלה בגלל הלקוחות ביקשה מהמזכירה לחזור למשרד החדש ביחד,?את מי הלקוחות בלבלו,המזכירה,המוקדנית,המוקדנית,המזכירה
D,31,filler,filler,הנואמות התכוננו ביחד לעלייה לבמה,אחרי סיום הנאום המפגינים העקשנים שמרו על הנואמת שנפגעה על-ידי המשאית שנסעה במהירות,?על מי המפגינים שמרו,המשאית,הנואמת,הנואמת,המשאית
D,32,filler,filler,הקשישות הלכו למועדון והמטפלת עישנה בחוץ,בכניסה למועדון הקליינטים קיללו את המטפלת הביישנית ששכחה לעזור לקשישה להתלבש לפני האירוע,?את מי הקליינטים קיללו,הקשישה,המטפלת,המטפלת,הקשישה
